Symbol,Name,Last Sale,Net Change,% Change,Market Cap,Country,IPO Year,Volume,Sector,Industry
NWL,Newell Brands Inc. Common Stock,$8.03,-0.63,-7.275%,3326026000.00,United States,,6041328,Industrials,Plastic Products
NXE,Nexgen Energy Ltd. Common Shares,$5.60,-0.17,-2.946%,2751601597.00,,2017,7005981,Basic Materials,Other Metals and Minerals
NXST,Nexstar Media Group Inc. Common Stock,$135.64,-5.07,-3.603%,4758603050.00,United States,2003,324892,Industrials,Broadcasting
NXT,Nextracker Inc. Class A Common Stock,$36.17,-2.86,-7.328%,2242022624.00,United States,2023,2370838,Technology,Semiconductors
NYCB,New York Community Bancorp Inc. Common Stock,$10.75,-0.28,-2.539%,7766609389.00,United States,,12528417,Finance,Banks
NYT,New York Times Company (The) Common Stock,$41.08,-0.20,-0.484%,6751053268.00,United States,,2150340,Consumer Discretionary,Newspapers/Magazines
OBDC,Blue Owl Capital Corporation Common Stock,$13.30,-0.24,-1.773%,5183447144.00,,2019,2372234,Finance,Diversified Financial Services
OGE,OGE Energy Corp Common Stock,$32.32,0.38,1.19%,6473287604.00,United States,,1783248,Utilities,Electric Utilities: Central
OGN,Organon & Co. Common Stock ,$16.29,-0.40,-2.397%,4163207949.00,United States,2021,2750864,Health Care,Biotechnology: Pharmaceutical Preparations
OGS,ONE Gas Inc. Common Stock,$66.46,0.80,1.218%,3685160478.00,United States,2014,561302,Utilities,Oil/Gas Transmission
OHI,Omega Healthcare Investors Inc. Common Stock,$32.03,-0.59,-1.809%,7843265374.00,United States,1992,2031433,Real Estate,Real Estate Investment Trusts
OI,O-I Glass Inc. Common Stock,$16.04,-0.55,-3.315%,2487161357.00,United States,,2661679,Consumer Discretionary,Containers/Packaging
OII,Oceaneering International Inc. Common Stock,$24.96,0.32,1.299%,2515457668.00,United States,,953359,Energy,Oilfield Services/Equipment
OLED,Universal Display Corporation Common Stock,$153.86,-2.19,-1.403%,7284719258.00,United States,,189824,Technology,Semiconductors
OLLI,Ollie's Bargain Outlet Holdings Inc. Common Stock,$75.28,-2.58,-3.314%,4645100833.00,United States,2015,719930,Consumer Discretionary,Department/Specialty Retail Stores
OLN,Olin Corporation Common Stock,$48.57,-0.30,-0.614%,6111380088.00,United States,,1409455,Industrials,Major Chemicals
OMAB,Grupo Aeroportuario del Centro Norte S.A.B. de C.V. ADS,$85.00,-0.03,-0.035%,8206100260.00,Mexico,2006,114186,Consumer Discretionary,Aerospace
OMCL,Omnicell Inc. Common Stock ($0.001 par value),$44.41,-0.75,-1.661%,2007866785.00,United States,2001,486674,Technology,Computer Manufacturing
OMF,OneMain Holdings Inc. Common Stock,$37.53,-1.71,-4.358%,4900610392.00,United States,2013,1258585,Finance,Finance: Consumer Services
ONB,Old National Bancorp Common Stock,$13.96,-0.30,-2.104%,4084542440.00,United States,,1180803,Finance,Major Banks
ONBPO,Old National Bancorp Depositary Shares Each Representing a 1/40th Interest in a Share of Series C Preferred Stock,$23.95,-0.45,-1.844%,7007506550.00,United States,,5196,Finance,Major Banks
ONBPP,Old National Bancorp Depositary Shares Each Representing a 1/40th Interest in a Share of Series A Preferred Stock,$23.92,0.34,1.442%,6998728880.00,United States,,8506,Finance,Major Banks
ONON,On Holding AG Class A Ordinary Shares,$25.99,-0.13,-0.498%,7328660200.00,,2021,5155563,Consumer Discretionary,Shoe Manufacturing
ONTO,Onto Innovation Inc. Common Stock,$125.39,-1.42,-1.12%,6152360787.00,United States,,345823,Industrials,Industrial Machinery/Components
OPCH,Option Care Health Inc. Common Stock,$32.48,-0.76,-2.286%,5842395411.00,United States,,1373979,Health Care,Medical/Nursing Services
OR,Osisko Gold Royalties Ltd Common Shares,$11.47,0.01,0.087%,2122535291.00,,2016,752365,,
ORA,Ormat Technologies Inc. Common Stock,$67.26,-0.92,-1.349%,4053110065.00,United States,2004,453226,Utilities,Electric Utilities: Central
ORI,Old Republic International Corporation Common Stock,$26.25,-0.11,-0.417%,7471871794.00,United States,,1388541,Finance,Property-Casualty Insurers
OSK,Oshkosh Corporation (Holding Company)Common Stock,$93.77,-0.65,-0.688%,6123282740.00,United States,,513759,Consumer Discretionary,Auto Manufacturing
OTEX,Open Text Corporation Common Shares,$34.15,-0.83,-2.373%,9261023073.00,Canada,1996,590537,Technology,EDP Services
OTTR,Otter Tail Corporation Common Stock,$74.42,0.54,0.731%,3104096973.00,United States,,228676,Utilities,Electric Utilities: Central
OXLCL,Oxford Lane Capital Corp. 6.75% Notes due 2031,$22.29,-0.004,-0.018%,3869544000.00,United States,,1893,Finance,Finance Companies
OXLCM,Oxford Lane Capital Corp. 6.75% Series 2024 Term Preferred Stock,$24.82,0.02,0.081%,4308752000.00,United States,,1271,Finance,Investment Managers
OXLCN,Oxford Lane Capital Corp. 7.125% Series 2029 Term Preferred Stock,$22.65,0.25,1.116%,3932040000.00,United States,,1810,Finance,Investment Managers
OXLCO,Oxford Lane Capital Corp. Preferred Stock Shares 6.00% Series 2029,$21.95,0.60,2.81%,3810520000.00,United States,,1538,Finance,Investment Managers
OXLCP,Oxford Lane Capital Corp. 6.25% Series 2027 Term Preferred Shares,$22.87,0.04,0.175%,3970232000.00,United States,,8299,Finance,Investment Managers
OXLCZ,Oxford Lane Capital Corp. 5.00% Notes due 2027,$22.315,0.005,0.022%,3873884000.00,United States,,2609,Finance,Finance Companies
OZK,Bank OZK Common Stock,$35.25,-0.54,-1.509%,8571190979.00,United States,,930772,Finance,Major Banks
OZKAP,Bank OZK 4.625% Series A Non-Cumulative Perpetual Preferred Stock,$14.67,-0.33,-2.20%,9073153899.00,United States,,51137,Finance,Major Banks
PAAS,Pan American Silver Corp. Common Stock,$13.74,0.04,0.292%,5007405600.00,Canada,,3875119,,
PAC,Grupo Aeroportuario Del Pacifico S.A. B. de C.V. Grupo Aeroportuario Del Pacifico S.A. de C.V. (each representing 10 Series B shares),$159.27,-6.79,-4.089%,8047554105.00,Mexico,2006,105104,Consumer Discretionary,Aerospace
PACWP,PacWest Bancorp Depositary Shares Each Representing a 1/40th Interest in a Share of 7.75% Fixed Rate Non-Cumulative Perpetual Preferred Stock Series A,$19.71,-0.27,-1.351%,2336478135.00,United States,,87767,Finance,Major Banks
PAGP,Plains GP Holdings L.P. Class A Units representing Limited Partner Interests,$15.30,-0.69,-4.315%,2998213123.00,United States,,5452966,Energy,Oil & Gas Production
PARA,Paramount Global Class B Common Stock,$11.99,-0.60,-4.766%,7806717165.00,United States,,17153117,Industrials,Broadcasting
PARAA,Paramount Global Class A Common Stock,$14.70,-0.80,-5.161%,9571204530.00,United States,,58395,Industrials,Broadcasting
PARR,Par Pacific Holdings Inc.  Common Stock,$34.08,-1.57,-4.404%,2081164451.00,United States,,895110,Energy,Integrated oil Companies
PATH,UiPath Inc. Class A Common Stock,$16.02,-1.22,-7.077%,9079144250.00,United States,2021,11900421,Technology,Computer Software: Prepackaged Software
PAX,Patria Investments Limited Class A Common Shares,$14.11,-0.43,-2.957%,2076891819.00,Cayman Islands,2021,186395,Finance,Investment Managers
PAYO,Payoneer Global Inc. Common Stock,$5.91,-0.30,-4.831%,2122702939.00,United States,,1928053,Technology,EDP Services
PB,Prosperity Bancshares Inc. Common Stock,$51.90,-1.28,-2.407%,4864195363.00,United States,,534861,Finance,Major Banks
PBF,PBF Energy Inc. Class A Common Stock,$49.36,-2.89,-5.531%,6100662527.00,United States,2012,4150772,Energy,Integrated oil Companies
PBH,Prestige Consumer Healthcare Inc. Common Stock,$57.09,-0.14,-0.245%,2828204631.00,United States,2005,182083,Health Care,Biotechnology: Pharmaceutical Preparations
PCH,PotlatchDeltic Corporation Common Stock,$44.83,-0.57,-1.256%,3582422593.00,United States,,386602,Real Estate,Real Estate Investment Trusts
PCOR,Procore Technologies Inc. Common Stock,$64.02,-2.72,-4.076%,9115437060.00,United States,2021,1159924,Technology,Computer Software: Prepackaged Software
PCVX,Vaxcyte Inc. Common Stock,$47.45,-1.59,-3.242%,4453036307.00,United States,2020,561587,Health Care,Biotechnology: Pharmaceutical Preparations
PD,PagerDuty Inc. Common Stock,$21.63,-0.87,-3.867%,2018323159.00,United States,2019,1225813,Technology,Computer Software: Prepackaged Software
PDCO,Patterson Companies Inc. Common Stock,$29.84,0.03,0.101%,2860164000.00,United States,1992,1127435,Health Care,Medical Specialities
PDI,PIMCO Dynamic Income Fund Common Stock,$16.78,-0.14,-0.827%,4079050200.00,United States,2012,2149185,Finance,Trusts Except Educational Religious and Charitable
PEAK,Healthpeak Properties Inc. Common Stock,$17.32,-0.49,-2.751%,9474980268.00,United States,,5546637,Real Estate,Real Estate Investment Trusts
PECO,Phillips Edison & Company Inc. Common Stock,$32.43,-0.52,-1.578%,3807282000.00,United States,2021,802080,Real Estate,Real Estate Investment Trusts
PEGA,Pegasystems Inc. Common Stock,$42.73,-0.45,-1.042%,3557185459.00,United States,1996,229372,Technology,EDP Services
PEN,Penumbra Inc. Common Stock,$232.69,-5.94,-2.489%,8943827113.00,United States,2015,319183,Health Care,Medical/Dental Instruments
PENN,PENN Entertainment Inc. Common Stock,$21.63,-0.91,-4.037%,3266937794.00,United States,1994,3139372,Consumer Discretionary,Hotels/Resorts
PFGC,Performance Food Group Company Common Stock,$56.27,-2.46,-4.189%,8789024282.00,United States,2015,955791,Consumer Discretionary,Food Distributors
PFSI,PennyMac Financial Services Inc. Common Stock,$63.63,-2.16,-3.283%,3173461240.00,United States,2013,454849,Finance,Finance: Consumer Services
PGNY,Progyny Inc. Common Stock,$33.26,-0.66,-1.946%,3173216232.00,United States,2019,388901,Health Care,Misc Health and Biotechnology Services
PHI,PLDT Inc. Sponsored ADR,$20.50,-0.02,-0.097%,4429143388.00,Philippines,,40304,Telecommunications,Telecommunications Equipment
PII,Polaris Inc. Common Stock,$99.22,-3.42,-3.332%,5624634260.00,United States,,566725,Consumer Discretionary,Recreational Games/Products/Toys
PINC,Premier Inc. Class A Common Stock,$20.80,-0.40,-1.887%,2478751621.00,United States,2013,1285218,Consumer Discretionary,Other Consumer Services
PIPR,Piper Sandler Companies Common Stock,$140.37,-2.97,-2.072%,2491487068.00,United States,,69614,Finance,Investment Bankers/Brokers/Service
PK,Park Hotels & Resorts Inc. Common Stock ,$11.68,-0.49,-4.026%,2519765925.00,United States,2016,3005204,Consumer Discretionary,Hotels/Resorts
PLNT,Planet Fitness Inc. Common Stock,$46.98,-1.25,-2.592%,4140898804.00,United States,2015,1803796,Consumer Discretionary,Hotels/Resorts
PLTK,Playtika Holding Corp. Common Stock,$9.80,0.12,1.24%,3591656488.00,Israel,2021,1200097,Technology,EDP Services
PLUG,Plug Power Inc. Common Stock,$6.53,-0.295,-4.322%,3930878969.00,United States,1999,25921925,Energy,Industrial Machinery/Components
PLXS,Plexus Corp. Common Stock,$92.70,-0.61,-0.654%,2547502142.00,United States,,124029,Technology,Electrical Products
PNFP,Pinnacle Financial Partners Inc. Common Stock,$64.26,-0.93,-1.427%,4932511106.00,United States,,541167,Finance,Major Banks
PNW,Pinnacle West Capital Corporation Common Stock,$71.87,0.60,0.842%,8143748030.00,United States,,876892,Utilities,Electric Utilities: Central
POR,Portland General Electric Co Common Stock,$39.49,0.59,1.517%,3992222358.00,United States,,1138883,Utilities,Electric Utilities: Central
POST,Post Holdings Inc. Common Stock,$84.84,0.16,0.189%,5193783733.00,United States,2012,408856,Consumer Staples,Packaged Foods
POWI,Power Integrations Inc. Common Stock,$75.49,-1.27,-1.655%,4332669738.00,United States,1997,184747,Technology,Semiconductors
POWWP,AMMO Inc. 8.75% Series A Cumulative Redeemable Perpetual Preferred Stock,$24.439,-0.266,-1.077%,2882773631.00,United States,,5504,Industrials,Ordnance And Accessories
PPBI,Pacific Premier Bancorp Inc,$20.99,-0.31,-1.455%,2012967531.00,United States,,395324,Finance,Major Banks
PPC,Pilgrim's Pride Corporation Common Stock,$23.07,0.50,2.215%,5462743662.00,United States,,1586010,Consumer Staples,Meat/Poultry/Fish
PR,Permian Resources Corporation Class A Common Stock,$13.44,-0.01,-0.074%,7524765830.00,United States,2022,12457971,Energy,Oil & Gas Production
PRGO,Perrigo Company plc Ordinary Shares,$30.79,-0.57,-1.818%,4168866025.00,United States,,1053567,Health Care,Biotechnology: Pharmaceutical Preparations
PRGS,Progress Software Corporation Common Stock (DE),$51.47,-0.71,-1.361%,2232046630.00,United States,1991,280565,Technology,Computer Software: Prepackaged Software
PRH,Prudential Financial Inc. 5.950% Junior Subordinated Notes due 2062,$23.45,-0.63,-2.616%,8512350000.00,United States,2022,64501,Finance,Life Insurance
PRI,Primerica Inc. Common Stock,$188.95,-2.16,-1.13%,6758143473.00,United States,2010,134625,Finance,Life Insurance
PRMW,Primo Water Corporation Common Stock,$13.41,0.03,0.224%,2137348157.00,Canada,,731798,Consumer Staples,Farming/Seeds/Milling
PRS,Prudential Financial Inc. 5.625% Junior Subordinated Notes due 2058,$23.01,-0.61,-2.583%,8352630000.00,United States,2018,43837,Finance,Life Insurance
PRTA,Prothena Corporation plc Ordinary Shares,$47.49,0.91,1.954%,2542391397.00,United States,,496292,Health Care,Biotechnology: Pharmaceutical Preparations
PRVA,Privia Health Group Inc. Common Stock,$22.32,-0.19,-0.844%,2619546803.00,United States,2021,498769,Technology,Retail: Computer Software & Peripheral Equipment
PSEC,Prospect Capital Corporation Common Stock,$5.88,-0.08,-1.342%,2396519503.00,United States,2004,2019028,Finance,Finance: Consumer Services
PSMT,PriceSmart Inc. Common Stock,$74.20,-0.46,-0.616%,2303837729.00,United States,,248197,Consumer Discretionary,Department/Specialty Retail Stores
PSN,Parsons Corporation Common Stock,$53.92,-0.53,-0.973%,5655417209.00,United States,2019,582970,Technology,EDP Services
PSNY,Polestar Automotive Holding UK PLC Class A ADS,$2.79,0.16,6.084%,5886738180.00,Sweden,,4789741,Consumer Discretionary,Auto Manufacturing
PSO,Pearson Plc Common Stock,$10.43,0.11,1.066%,7447020000.00,United Kingdom,,258235,Consumer Discretionary,Books
PTEN,Patterson-UTI Energy Inc. Common Stock,$13.01,-0.05,-0.383%,2705996593.00,United States,1993,5477634,Energy,Oil & Gas Production
PVH,PVH Corp. Common Stock,$71.49,-3.73,-4.959%,4319778818.00,United States,,1001435,Consumer Discretionary,Apparel
PWSC,PowerSchool Holdings Inc. Class A Common Stock,$21.68,-0.09,-0.413%,4361802148.00,United States,2021,566361,Technology,Computer Software: Prepackaged Software
PYCR,Paycor HCM Inc. Common Stock,$23.01,0.34,1.50%,4069619241.00,United States,2021,679828,Technology,Computer Software: Prepackaged Software
PZZA,Papa John's International Inc. Common Stock,$65.26,-3.25,-4.744%,2136407614.00,United States,1993,976231,Consumer Discretionary,Restaurants
QDEL,QuidelOrtho Corporation Common Stock,$72.98,0.27,0.371%,4874379375.00,United States,,400653,Health Care,Medical Specialities
QFIN,Qifu Technology Inc. American Depositary Shares,$15.11,-0.45,-2.892%,2438694044.00,China,2018,521120,Finance,Finance: Consumer Services
QGEN,Qiagen N.V. Common Shares ,$39.74,-0.29,-0.724%,9049592800.00,Netherlands,,819615,Health Care,Biotechnology: Biological Products (No Diagnostic Substances)
QLYS,Qualys Inc. Common Stock,$151.49,-1.46,-0.955%,5561512242.00,United States,2012,228075,Technology,Computer Software: Prepackaged Software
QRTEB,Qurate Retail Inc. Series B Common Stock ,$7.82,0.11,1.427%,3040325218.00,United States,,11077,Consumer Discretionary,Catalog/Specialty Distribution
QRTEP,Qurate Retail Inc. 8.0% Fixed Rate Cumulative Redeemable Preferred Stock,$23.01,-2.74,-10.641%,8946020877.00,United States,,251609,Consumer Discretionary,Catalog/Specialty Distribution
QRVO,Qorvo Inc. Common Stock,$93.73,-1.39,-1.461%,9177146010.00,United States,,1038099,Technology,Semiconductors
QS,QuantumScape Corporation Class A Common Stock,$6.12,-0.36,-5.556%,2739672260.00,United States,2020,6467602,Consumer Discretionary,Auto Parts:O.E.M.
R,Ryder System Inc. Common Stock,$104.51,-1.22,-1.154%,4758054152.00,United States,,373000,Consumer Discretionary,Rental/Leasing Companies
RARE,Ultragenyx Pharmaceutical Inc. Common Stock,$35.46,0.66,1.897%,2534985685.00,United States,2014,633792,Health Care,Biotechnology: Pharmaceutical Preparations
RBC,RBC Bearings Incorporated Common Stock,$230.08,0.94,0.41%,6685229789.00,United States,2022,183173,Industrials,Metal Fabrications
RBCP,RBC Bearings Incorporated 5.00% Series A Mandatory Convertible Preferred Stock,$108.31,-1.10,-1.005%,3147067274.00,United States,2022,2640,Industrials,Metal Fabrications
RCB,Ready Capital Corporation 6.20% Senior Notes due 2026,$23.67,0.01,0.042%,4070572837.00,United States,2019,2795,Real Estate,Real Estate Investment Trusts
RCC,Ready Capital Corporation 5.75% Senior Notes due 2026,$23.75,-0.0399,-0.168%,4084330583.00,United States,2021,1405,Real Estate,Real Estate Investment Trusts
RCM,R1 RCM Inc. Common Stock,$14.03,-0.92,-6.154%,5877987965.00,United States,,2690655,Consumer Discretionary,Other Consumer Services
RDN,Radian Group Inc. Common Stock,$24.85,-0.24,-0.957%,3912032696.00,United States,,1516302,Finance,Property-Casualty Insurers
REG,Regency Centers Corporation Common Stock,$56.99,-1.08,-1.86%,9745473337.00,United States,1993,885541,Real Estate,Real Estate Investment Trusts
RELY,Remitly Global Inc. Common Stock,$24.53,-0.63,-2.504%,4444802786.00,United States,2021,864285,Technology,Computer Software: Prepackaged Software
REXR,Rexford Industrial Realty Inc. Common Stock,$47.21,-1.50,-3.079%,9746114593.00,United States,2013,1639524,Real Estate,Real Estate Investment Trusts
REYN,Reynolds Consumer Products Inc. Common Stock,$25.59,0.31,1.226%,5374136221.00,United States,2020,592721,Industrials,Office Equipment/Supplies/Services
REZI,Resideo Technologies Inc. Common Stock ,$15.44,-0.29,-1.844%,2279758059.00,United States,2018,380604,Industrials,Wholesale Distributors
RGA,Reinsurance Group of America Incorporated Common Stock,$142.32,-1.00,-0.698%,9423263234.00,United States,,416484,Finance,Life Insurance
RGEN,Repligen Corporation Common Stock,$151.17,-3.79,-2.446%,8428683197.00,United States,1986,490555,Health Care,Medical/Dental Instruments
RGLD,Royal Gold Inc. Common Stock,$103.27,0.40,0.389%,6783675560.00,United States,,314803,Industrials,Precious Metals
RH,RH Common Stock,$253.56,-8.45,-3.225%,4665552684.00,United States,2012,649930,Consumer Discretionary,Other Specialty Stores
RHI,Robert Half Inc. Common Stock,$73.82,1.79,2.485%,7904813836.00,United States,,898480,Consumer Discretionary,Professional Services
RHP,Ryman Hospitality Properties Inc. (REIT),$82.05,-1.62,-1.936%,4898917340.00,United States,,594530,Real Estate,Real Estate Investment Trusts
RIG,Transocean Ltd (Switzerland) Common Stock,$7.75,-0.13,-1.65%,5941577645.00,Switzerland,,18490324,Energy,Oil & Gas Production
RITM,Rithm Capital Corp. Common Stock,$9.01,-0.28,-3.014%,4354718660.00,United States,,5398098,Real Estate,Real Estate Investment Trusts
RKLB,Rocket Lab USA Inc. Common Stock,$4.17,-0.22,-5.011%,2015471980.00,United States,2020,3795106,Industrials,Aerospace
RL,Ralph Lauren Corporation Common Stock,$112.33,-3.61,-3.114%,7331692269.00,United States,1997,764119,Consumer Discretionary,Apparel
RLI,RLI Corp. Common Stock (DE),$133.85,-0.17,-0.127%,6103050835.00,United States,,95788,Finance,Property-Casualty Insurers
RLX,RLX Technology Inc. American Depositary Shares each representing the right to receive one (1) Class A ordinary share,$1.52,0.00,0.00%,2387601666.00,,2021,2876895,Health Care, Medicinal Chemicals and Botanical Products 
RMBS,Rambus Inc. Common Stock,$54.73,-1.44,-2.564%,5972765681.00,United States,1997,1026781,Technology,Semiconductors
RNG,RingCentral Inc. Class A Common Stock,$28.69,-1.41,-4.684%,2716500227.00,United States,2013,930404,Technology,EDP Services
ROG,Rogers Corporation Common Stock,$129.55,-1.24,-0.948%,2411708759.00,United States,1960,63850,Industrials,Major Chemicals
ROIV,Roivant Sciences Ltd. Common Shares,$10.42,-0.095,-0.903%,8041553693.00,United Kingdom,,11808422,Health Care,Biotechnology: Pharmaceutical Preparations
ROKU,Roku Inc. Class A Common Stock,$68.65,-1.85,-2.624%,9714509852.00,United States,2017,4563804,Telecommunications,Cable & Other Pay Television Services
RPD,Rapid7 Inc. Common Stock,$45.23,-1.06,-2.29%,2757513076.00,United States,2015,495572,Technology,Computer Software: Prepackaged Software
RRC,Range Resources Corporation Common Stock,$31.02,0.58,1.905%,7486741522.00,United States,,2766562,Energy,Oil & Gas Production
RRR,Red Rock Resorts Inc. Class A Common Stock,$39.83,-1.22,-2.972%,4157321850.00,United States,2016,433387,Consumer Discretionary,Hotels/Resorts
RRX,Regal Rexnord Corporation Common Stock,$138.23,-3.33,-2.352%,9166220813.00,United States,1976,418520,,
RUN,Sunrun Inc. Common Stock,$10.66,-0.58,-5.16%,2315174586.00,United States,2015,14876030,Miscellaneous,Industrial Machinery/Components
RUSHA,Rush Enterprises Inc. Common Stock Cl A,$40.18,-0.45,-1.108%,3244730556.00,United States,,290374,Consumer Discretionary,Other Specialty Stores
RUSHB,Rush Enterprises Inc. Class B,$44.63,-0.67,-1.479%,3604089714.00,United States,,18317,Consumer Discretionary,Retail-Auto Dealers and Gas Stations
RVMD,Revolution Medicines Inc. Common Stock,$24.53,-1.64,-6.267%,2677937573.00,United States,2020,4136759,Health Care,Biotechnology: Biological Products (No Diagnostic Substances)
RXO,RXO Inc. Common Stock,$18.82,-0.68,-3.487%,2201608542.00,United States,2022,659340,,
RYN,Rayonier Inc. REIT Common Stock,$27.27,-0.36,-1.303%,4043283577.00,United States,,486275,Real Estate,Real Estate Investment Trusts
S,SentinelOne Inc. Class A Common Stock,$16.27,-0.60,-3.557%,4810613247.00,United States,2021,7797178,Technology,EDP Services
SAIC,SCIENCE APPLICATIONS INTERNATIONAL CORPORATION Common Stock,$105.83,-1.09,-1.019%,5602148514.00,United States,,428597,Technology,EDP Services
SAM,Boston Beer Company Inc. (The) Common Stock,$380.61,-13.10,-3.327%,4657035867.00,United States,,134246,Consumer Staples,Beverages (Production/Distribution)
SANM,Sanmina Corporation Common Stock,$53.80,-0.39,-0.72%,3078809856.00,United States,1993,229556,Technology,Electrical Products
SBRA,Sabra Health Care REIT Inc. Common Stock,$13.50,-0.14,-1.026%,3121451883.00,United States,,2900599,Real Estate,Real Estate Investment Trusts
SBS,Companhia de saneamento Basico Do Estado De Sao Paulo - Sabesp American Depositary Shares (Each repstg 250 Common Shares),$11.58,-0.31,-2.607%,7915044283.00,Brazil,2002,1386094,Utilities,Water Supply
SBSW,D/B/A Sibanye-Stillwater Limited ADS,$5.56,-0.29,-4.957%,3934478400.00,South Africa,,8801593,Basic Materials,Precious Metals
SCI,Service Corporation International Common Stock,$54.90,-0.74,-1.33%,8282070711.00,United States,,1965624,Consumer Discretionary,Other Consumer Services
SCPL,SciPlay Corporation Class A Common Stock,$22.75,0.02,0.088%,2838424612.00,United States,2019,186617,Technology,EDP Services
SDRL,Seadrill Limited Common Shares,$43.94,-0.17,-0.385%,3509487800.00,,2022,747355,Energy,Oil & Gas Production
SEAS,SeaWorld Entertainment Inc. Common Stock,$44.56,-1.30,-2.835%,2850564693.00,United States,2013,1071887,Health Care,Biotechnology: Electromedical & Electrotherapeutic Apparatus
SEB,Seaboard Corporation Common Stock,$3650.00,-57.00,-1.538%,4236843350.00,United States,1996,1171,Industrials,Farming/Seeds/Milling
SEDG,SolarEdge Technologies Inc. Common Stock,$120.31,-2.25,-1.836%,6804470843.00,Israel,2015,2379749,Technology,Semiconductors
SEE,Sealed Air Corporation Common Stock,$31.45,-1.39,-4.233%,4541699186.00,United States,,1578210,Industrials,Major Chemicals
SEIC,SEI Investments Company Common Stock,$57.04,-2.13,-3.60%,7549703457.00,United States,1981,550435,Finance,Investment Bankers/Brokers/Service
SEM,Select Medical Holdings Corporation Common Stock,$24.67,-0.34,-1.359%,3136628097.00,United States,2009,630123,Health Care,Hospital/Nursing Management
SF,Stifel Financial Corporation Common Stock,$57.96,-2.53,-4.183%,6053840856.00,United States,,592550,Finance,Investment Bankers/Brokers/Service
SFB,Stifel Financial Corporation 5.20% Senior Notes due 2047,$19.33,-1.3446,-6.504%,2018991438.00,United States,2017,12567,Finance,Investment Bankers/Brokers/Service
SFBS,ServisFirst Bancshares Inc. Common Stock,$52.20,-0.46,-0.874%,2840898400.00,United States,,201925,Finance,Major Banks
SFM,Sprouts Farmers Market Inc. Common Stock,$41.49,-0.51,-1.214%,4232235786.00,United States,2013,1698767,Consumer Staples,Food Chains
SFNC,Simmons First National Corporation Class A Common Stock,$16.34,-0.22,-1.329%,2063114332.00,United States,,443384,Finance,Major Banks
SGML,Sigma Lithium Corporation Common Shares,$29.67,-0.66,-2.176%,3245612397.00,Canada,,750817,Basic Materials,Metal Mining
SGRY,Surgery Partners Inc. Common Stock,$27.98,-1.25,-4.276%,3539439782.00,United States,2015,814328,Health Care,Hospital/Nursing Management
SHAK,Shake Shack Inc. Class A Common Stock,$56.49,-2.28,-3.88%,2389357304.00,United States,2015,1025227,Consumer Discretionary,Restaurants
SHC,Sotera Health Company Common Stock,$14.55,-0.13,-0.886%,4112058770.00,United States,2020,876324,Health Care,Medical Specialities
SHLS,Shoals Technologies Group Inc. Class A Common Stock,$16.47,-0.67,-3.909%,2798903581.00,United States,2021,3812784,Technology,Semiconductors
SHOO,Steven Madden Ltd. Common Stock,$31.36,-0.43,-1.353%,2361864257.00,United States,1993,354638,Consumer Discretionary,Shoe Manufacturing
SID,Companhia Siderurgica Nacional S.A. Common Stock,$2.28,-0.06,-2.564%,3023494199.00,Brazil,,2517003,Industrials,Steel/Iron Ore
SIG,Signet Jewelers Limited Common Shares,$70.40,-2.27,-3.124%,3159986790.00,Bermuda,,658274,Consumer Discretionary,Consumer Specialties
SIGI,Selective Insurance Group Inc. Common Stock,$104.69,1.69,1.641%,6340744155.00,United States,,318603,Finance,Property-Casualty Insurers
SIM,Grupo Simec S.A.B. de C.V. American Depositary Shares,$32.25,0.00,0.00%,4967960796.00,Mexico,1998,454,Industrials,Steel/Iron Ore
SITC,SITE Centers Corp. Common Stock,$11.78,-0.32,-2.645%,2465245670.00,United States,,969112,Real Estate,Real Estate Investment Trusts
