Symbol,Name,Last Sale,Net Change,% Change,Market Cap,Country,IPO Year,Volume,Sector,Industry
CFLT,Confluent Inc. Class A Common Stock,$28.29,-1.34,-4.522%,8555507488.00,United States,2021,3620233,Technology,EDP Services
CFR,Cullen/Frost Bankers Inc. Common Stock,$87.89,-1.68,-1.876%,5635780226.00,United States,,463262,Finance,Major Banks
CG,The Carlyle Group Inc. Common Stock,$29.55,-0.51,-1.697%,10636584910.00,United States,2012,2656999,Finance,Investment Managers
CGABL,The Carlyle Group Inc. 4.625% Subordinated Notes due 2061,$16.33,0.00,0.00%,5878017989.00,United States,,68916,Finance,Investment Managers
CGNX,Cognex Corporation Common Stock,$41.25,-0.98,-2.321%,7107090994.00,United States,1989,492449,Industrials,Industrial Machinery/Components
CHD,Church & Dwight Company Inc. Common Stock,$90.97,-0.68,-0.742%,22382894680.00,United States,,1174613,Consumer Discretionary,Package Goods/Cosmetics
CHDN,Churchill Downs Incorporated Common Stock,$113.40,-1.33,-1.159%,8490160022.00,United States,,548363,Consumer Discretionary,Services-Misc. Amusement & Recreation
CHE,Chemed Corp,$507.50,-8.50,-1.647%,7651384143.00,United States,,50871,Health Care,Medical/Nursing Services
CHH,Choice Hotels International Inc. Common Stock,$118.73,-2.64,-2.175%,5981331854.00,United States,,400513,Consumer Discretionary,Hotels/Resorts
CHK,Chesapeake Energy Corporation Common Stock,$82.97,-0.67,-0.801%,11107117485.00,United States,,1368532,Energy,Oil & Gas Production
CHKEL,Chesapeake Energy Corporation Class C Warrants,$67.19,-1.14,-1.668%,8893028061.00,United States,,204,Energy,Oil & Gas Production
CHKEW,Chesapeake Energy Corporation Class A Warrants,$73.71,-6.00,-7.527%,9755991939.00,United States,,340,Energy,Oil & Gas Production
CHKP,Check Point Software Technologies Ltd. Ordinary Shares,$132.82,-0.66,-0.494%,16039343200.00,Israel,1996,694511,Technology,Computer Software: Prepackaged Software
CHRD,Chord Energy Corporation Common Stock,$158.29,0.16,0.101%,6573900518.00,United States,,526416,Energy,Oil & Gas Production
CHRW,C.H. Robinson Worldwide Inc. Common Stock,$85.71,0.06,0.07%,9979332208.00,United States,1997,851112,Consumer Discretionary,Oil Refining/Marketing
CHT,Chunghwa Telecom Co. Ltd.,$35.70,-0.18,-0.502%,27694084184.00,Taiwan,,142244,Telecommunications,Telecommunications Equipment
CHTR,Charter Communications Inc. Class A Common Stock New,$432.17,-6.33,-1.444%,64683291004.00,United States,,865560,Telecommunications,Cable & Other Pay Television Services
CHWY,Chewy Inc. Class A Common Stock,$18.02,-0.57,-3.066%,7754551501.00,United States,2019,5677340,Consumer Discretionary,Catalog/Specialty Distribution
CHX,ChampionX Corporation Common Stock ,$34.97,0.13,0.373%,6874469148.00,United States,,933523,Industrials,Industrial Machinery/Components
CI,The Cigna Group Common Stock,$284.41,-3.13,-1.089%,84179710195.00,United States,,989109,Health Care,Medical Specialities
CIB,BanColombia S.A. Common Stock,$25.20,-0.95,-3.633%,6059510100.00,Colombia,,359740,Finance,Commercial Banks
CIEN,Ciena Corporation Common Stock,$46.46,-0.70,-1.484%,6868755813.00,United States,1997,1017972,Utilities,Telecommunications Equipment
CIG,Comp En De Mn Cemig ADS American Depositary Shares,$2.29,-0.11,-4.583%,5041138876.00,Brazil,,2997405,Utilities,Electric Utilities: Central
CIGI,Colliers International Group Inc. Subordinate Voting Shares,$93.26,-0.10,-0.107%,4399948606.00,Canada,,138227,Finance,Real Estate
CII,Blackrock Capital and Income Fund Inc.,$18.36,-0.28,-1.502%,2741196342.00,United States,2004,61840,Finance,Investment Bankers/Brokers/Service
CINF,Cincinnati Financial Corporation Common Stock,$99.78,-0.28,-0.28%,15651107844.00,United States,,548827,Finance,Property-Casualty Insurers
CIVI,Civitas Resources Inc. Common Stock,$77.21,-0.25,-0.323%,7239261022.00,United States,2017,927218,Energy,Oil & Gas Production
CL,Colgate-Palmolive Company Common Stock,$70.47,-0.29,-0.41%,58256952049.00,United States,,3174345,Consumer Discretionary,Package Goods/Cosmetics
CLF,Cleveland-Cliffs Inc. Common Stock,$15.14,-0.57,-3.628%,7701447312.00,United States,,11026855,Basic Materials,Metal Mining
CLH,Clean Harbors Inc. Common Stock,$162.27,-1.56,-0.952%,8787055184.00,United States,,147202,Industrials,Environmental Services
CLS,Celestica Inc. Common Stock,$23.70,-0.67,-2.749%,2827931400.00,Canada,1998,1898930,Technology,Electrical Products
CLVT,Clarivate Plc Ordinary Shares,$6.20,-0.55,-8.148%,4192652741.00,United Kingdom,2019,5272876,Technology,EDP Services
CLX,Clorox Company (The) Common Stock,$130.25,-0.09,-0.069%,16128335588.00,United States,,1589223,Consumer Discretionary,Specialty Chemicals
CM,Canadian Imperial Bank of Commerce Common Stock,$36.71,-0.93,-2.471%,33921285754.00,Canada,,1747582,Finance,Commercial Banks
CMA,Comerica Incorporated Common Stock,$39.61,-0.64,-1.59%,5219668076.00,United States,,2258177,Finance,Major Banks
CMC,Commercial Metals Company Common Stock,$47.50,-1.04,-2.143%,5573778155.00,United States,,1150196,Industrials,Steel/Iron Ore
CMCSA,Comcast Corporation Class A Common Stock,$43.45,-0.75,-1.697%,179237025548.00,United States,,16980454,Telecommunications,Cable & Other Pay Television Services
CME,CME Group Inc. Class A Common Stock,$201.66,1.51,0.754%,72806328990.00,United States,2002,1636802,Finance,Investment Bankers/Brokers/Service
CMG,Chipotle Mexican Grill Inc. Common Stock,$1837.19,-29.94,-1.604%,50683686727.00,United States,2006,196057,Consumer Discretionary,Restaurants
CMI,Cummins Inc. Common Stock,$223.90,-1.65,-0.732%,31714792183.00,United States,,543034,Industrials,Industrial Machinery/Components
CMS,CMS Energy Corporation Common Stock,$51.87,1.30,2.571%,15131862477.00,United States,,4346801,Utilities,Power Generation
CMSA,CMS Energy Corporation 5.625% Junior Subordinated Notes due 2078,$21.66,-0.3494,-1.588%,8140596085.00,United States,2018,7165,Utilities,Power Generation
CMSC,CMS Energy Corporation 5.875% Junior Subordinated Notes due 2078,$22.21,-0.20,-0.892%,8347305589.00,United States,2018,69529,Utilities,Power Generation
CMSD,CMS Energy Corporation 5.875% Junior Subordinated Notes due 2079,$22.32,-0.32,-1.413%,8388647490.00,United States,2019,75713,Utilities,Power Generation
CNA,CNA Financial Corporation Common Stock,$38.34,-0.70,-1.793%,10384838997.00,United States,,90042,Finance,Property-Casualty Insurers
CNC,Centene Corporation Common Stock,$68.24,-1.06,-1.53%,36950538083.00,United States,,2803391,Health Care,Medical Specialities
CNHI,CNH Industrial N.V. Common Shares,$11.66,-0.17,-1.437%,15558561775.00,United Kingdom,2013,5594750,Industrials,Construction/Ag Equipment/Trucks
CNI,Canadian National Railway Company Common Stock,$106.08,-0.32,-0.301%,70437120000.00,Canada,,2049577,Industrials,Railroads
CNK,Cinemark Holdings Inc Cinemark Holdings Inc. Common Stock,$18.22,-0.27,-1.46%,2216164010.00,United States,2007,4803279,Consumer Discretionary,Movies/Entertainment
CNM,Core & Main Inc. Class A Common Stock,$28.40,-0.13,-0.456%,6424701307.00,United States,2021,2079029,Consumer Discretionary,Durable Goods
CNMD,CONMED Corporation Common Stock,$100.01,0.69,0.695%,3074282498.00,United States,1987,444706,Health Care,Biotechnology: Electromedical & Electrotherapeutic Apparatus
CNO,CNO Financial Group Inc. Common Stock,$22.86,-0.68,-2.889%,2583104836.00,United States,,591782,Finance,Life Insurance
CNP,CenterPoint Energy Inc (Holding Co) Common Stock,$26.35,0.60,2.33%,16631753445.00,United States,,6963073,Utilities,Electric Utilities: Central
CNQ,Canadian Natural Resources Limited Common Stock,$63.26,0.15,0.238%,69096367600.00,Canada,,1930712,Energy,Oil & Gas Production
CNS,Cohen & Steers Inc Common Stock,$59.73,-2.27,-3.661%,2934525522.00,United States,2004,142428,Finance,Investment Managers
CNX,CNX Resources Corporation Common Stock,$21.90,-0.11,-0.50%,3536082142.00,United States,1999,2037601,Energy,Oil & Gas Production
CNXC,Concentrix Corporation Common Stock,$78.30,-1.99,-2.479%,4075794609.00,United States,,462969,Technology,Computer Software: Prepackaged Software
COF,Capital One Financial Corporation Common Stock,$93.05,-2.07,-2.176%,35493126829.00,United States,1994,2191785,Finance,Major Banks
COHR,Coherent Corp. Common Stock,$31.29,-1.04,-3.217%,4361130705.00,United States,,2485457,Technology,Electronic Components
COIN,Coinbase Global Inc. Class A Common Stock,$72.48,-2.83,-3.758%,17190534165.00,United States,,5755817,Finance,Finance: Consumer Services
COKE,Coca-Cola Consolidated Inc. Common Stock,$633.92,-2.48,-0.39%,5942168931.00,United States,1972,21648,Consumer Staples,Beverages (Production/Distribution)
COLB,Columbia Banking System Inc. Common Stock,$18.91,-0.56,-2.876%,3944074357.00,United States,1992,1266607,Finance,Major Banks
COLD,Americold Realty Trust Inc. Common Stock,$28.73,-0.86,-2.906%,7764424742.00,United States,2018,2139059,Finance,Real Estate
COLM,Columbia Sportswear Company Common Stock,$70.73,-0.10,-0.141%,4337888865.00,United States,1998,402277,Consumer Discretionary,Apparel
COO,The Cooper Companies Inc. Common Stock,$312.91,1.01,0.324%,15496601464.00,United States,,294683,Health Care,Ophthalmic Goods
COOP,Mr. Cooper Group Inc. Common Stock,$53.04,-0.93,-1.723%,3545646880.00,United States,,509989,Finance,Finance: Consumer Services
COP,ConocoPhillips Common Stock,$117.60,0.50,0.427%,140824903145.00,United States,,4162619,Energy,Integrated oil Companies
COR,Cencora Inc. Common Stock,$180.27,1.19,0.665%,36446061291.00,United States,,810752,Health Care,Other Pharmaceuticals
CORT,Corcept Therapeutics Incorporated Common Stock,$26.17,-0.12,-0.456%,2683644679.00,United States,2004,783331,Health Care,Biotechnology: Pharmaceutical Preparations
COST,Costco Wholesale Corporation Common Stock,$565.04,-6.27,-1.097%,250396617704.00,United States,,2003781,Consumer Discretionary,Department/Specialty Retail Stores
COTY,Coty Inc. Class A Common Stock,$10.30,-0.44,-4.097%,8783807164.00,United States,2013,7549992,Consumer Discretionary,Package Goods/Cosmetics
COUR,Coursera Inc. Common Stock,$18.12,-0.27,-1.468%,2712404399.00,United States,2021,1297192,Technology,Computer Software: Prepackaged Software
CP,Canadian Pacific Kansas City Limited Common Shares,$73.53,0.62,0.85%,68485842000.00,Canada,,2362178,Industrials,Railroads
CPA,Copa Holdings S.A. Class A Common Stock,$83.37,-2.99,-3.462%,2374377600.00,Panama,2005,573219,Consumer Discretionary,Air Freight/Delivery Services
CPB,Campbell Soup Company Common Stock,$39.87,0.37,0.937%,11879075921.00,United States,,3208440,Consumer Staples,Packaged Foods
CPE,Callon Petroleum Company Common Stock,$36.43,-0.40,-1.086%,2482975539.00,United States,,1607435,Energy,Oil & Gas Production
CPG,Crescent Point Energy Corporation Ordinary Shares (Canada),$7.91,0.03,0.381%,4253871709.00,Canada,,3763639,Energy,Oil & Gas Production
CPNG,Coupang Inc. Class A Common Stock,$16.66,-0.30,-1.769%,29717170825.00,,2021,5420032,Consumer Discretionary,Durable Goods
CPRI,Capri Holdings Limited Ordinary Shares,$51.75,-0.69,-1.316%,6006467509.00,Hong Kong,2011,3626026,Consumer Discretionary,Apparel
CPRT,Copart Inc. (DE) Common Stock,$42.62,-1.00,-2.293%,40802497078.00,United States,1994,3954444,Consumer Discretionary,Retail-Auto Dealers and Gas Stations
CPT,Camden Property Trust Common Stock,$92.51,-0.54,-0.58%,9877342378.00,United States,1993,1304734,Real Estate,Real Estate Investment Trusts
CQP,Cheniere Energy Partners LP Common Units,$53.10,-0.71,-1.319%,25702318131.00,United States,2007,144850,Utilities,Oil/Gas Transmission
CR,Crane Company Common Stock,$86.10,-0.71,-0.818%,4890215845.00,United States,2023,192194,Industrials,Metal Fabrications
CRBG,Corebridge Financial Inc. Common Stock,$19.57,-0.37,-1.856%,12445683109.00,United States,2022,1912526,Finance,Life Insurance
CRC,California Resources Corporation Common Stock,$54.62,0.22,0.404%,3766716456.00,United States,2020,452407,Energy,Oil & Gas Production
CRDO,Credo Technology Group Holding Ltd Ordinary Shares,$15.60,-0.34,-2.133%,2340448297.00,United States,2022,1201110,Technology,Semiconductors
CRH,CRH PLC Ordinary Shares,$53.41,-0.64,-1.184%,39017815599.00,Ireland,,4178311,Industrials,Building Materials
CRI,Carter's Inc. Common Stock,$66.35,-1.82,-2.67%,2472088669.00,United States,2003,774768,Consumer Discretionary,Apparel
CRK,Comstock Resources Inc. Common Stock,$10.58,-0.01,-0.094%,2946323764.00,United States,,3237055,Energy,Oil & Gas Production
CRL,Charles River Laboratories International Inc. Common Stock,$191.68,-1.71,-0.884%,9827693710.00,United States,2000,317735,Health Care,Biotechnology: Commercial Physical & Biological Resarch
CRM,Salesforce Inc. Common Stock,$199.83,-3.88,-1.905%,194434590000.00,United States,2004,4620670,Technology,Computer Software: Prepackaged Software
CROX,Crocs Inc. Common Stock,$85.94,-1.94,-2.208%,5297707533.00,United States,2006,1339253,Consumer Discretionary,Shoe Manufacturing
CRS,Carpenter Technology Corporation Common Stock,$64.49,-2.09,-3.139%,3150205327.00,United States,,468322,Industrials,Steel/Iron Ore
CRSP,CRISPR Therapeutics AG Common Shares,$42.94,0.53,1.25%,3409927663.00,Switzerland,2016,1496097,Health Care,Biotechnology: Biological Products (No Diagnostic Substances)
CRUS,Cirrus Logic Inc. Common Stock,$71.75,-1.27,-1.739%,3925421980.00,United States,1989,411951,Technology,Semiconductors
CRVL,CorVel Corp. Common Stock,$195.01,-2.99,-1.51%,3337349852.00,United States,,20753,Finance,Specialty Insurers
CRWD,CrowdStrike Holdings Inc. Class A Common Stock,$162.03,-7.51,-4.43%,38690852208.00,United States,2019,3252329,Technology,Computer Software: Prepackaged Software
CSAN,Cosan S.A. ADS,$12.61,-0.39,-3.00%,5908037200.00,,2021,340837,Consumer Discretionary,Retail-Auto Dealers and Gas Stations
CSCO,Cisco Systems Inc. Common Stock (DE),$53.65,-0.35,-0.648%,217543120058.00,United States,1990,15699709,Telecommunications,Computer Communications Equipment
CSGP,CoStar Group Inc. Common Stock,$75.16,-0.81,-1.066%,30690578856.00,United States,1998,1602146,Consumer Discretionary,Business Services
CSL,Carlisle Companies Incorporated Common Stock,$251.13,-0.60,-0.238%,12536163493.00,United States,,255848,Industrials,Specialty Chemicals
CSQ,Calamos Strategic Total Return Common Stock,$13.76,-0.27,-1.924%,2186293679.00,United States,2004,225081,Finance,Finance Companies
CSTM,Constellium SE Ordinary Shares (France),$17.14,-0.72,-4.031%,2473302000.00,Netherlands,2013,786892,Industrials,Metal Fabrications
CSWI,CSW Industrials Inc. Common Stock,$172.12,-2.60,-1.488%,2675441886.00,United States,,27462,Industrials,Home Furnishings
CSX,CSX Corporation Common Stock,$30.77,0.23,0.753%,61734775854.00,United States,,17736787,Industrials,Railroads
CTAS,Cintas Corporation Common Stock,$480.87,-4.00,-0.825%,48924465881.00,United States,1983,486566,Consumer Discretionary,Business Services
CTLT,Catalent Inc. Common Stock,$43.95,-0.63,-1.413%,7914976728.00,United States,2014,1320901,Health Care,Biotechnology: Pharmaceutical Preparations
CTRA,Coterra Energy Inc. Common Stock,$26.34,0.02,0.076%,19887899524.00,United States,,5015111,Energy,Oil & Gas Production
CTSH,Cognizant Technology Solutions Corporation Class A Common Stock,$67.30,-0.46,-0.679%,33989285682.00,United States,1998,4139584,Technology,EDP Services
CTVA,Corteva Inc. Common Stock ,$50.34,0.29,0.579%,35729519760.00,United States,2019,3856932,Industrials,Major Chemicals
CUBE,CubeSmart Common Shares,$37.04,-0.47,-1.253%,8326909655.00,United States,,1190702,Real Estate,Real Estate Investment Trusts
CUK,Carnival Plc ADS ADS,$11.37,-0.80,-6.574%,2124087642.00,United States,,2082628,Consumer Discretionary,Marine Transportation
CUZ,Cousins Properties Incorporated Common Stock,$18.91,-1.08,-5.403%,2870055190.00,United States,,2716965,Real Estate,Real Estate Investment Trusts
CVBF,CVB Financial Corporation Common Stock,$15.62,-0.31,-1.946%,2176555514.00,United States,,1534776,Finance,Major Banks
CVCO,Cavco Industries Inc. Common Stock When Issued,$253.97,-8.68,-3.305%,2203742897.00,United States,,88740,Consumer Discretionary,Homebuilding
CVE,Cenovus Energy Inc Common Stock,$20.02,-0.08,-0.398%,37967789860.00,Canada,,7238076,Energy,Oil & Gas Production
CVI,CVR Energy Inc. Common Stock,$32.34,-1.06,-3.174%,3251159572.00,United States,2007,1121596,Energy,Integrated oil Companies
CVLT,Commvault Systems Inc. Common Stock,$67.08,-1.21,-1.772%,2943115748.00,United States,2006,181317,Technology,Computer Software: Prepackaged Software
CVNA,Carvana Co. Class A Common Stock,$38.21,-1.04,-2.65%,7238660246.00,United States,2017,7307179,Consumer Discretionary,Other Specialty Stores
CVS,CVS Health Corporation Common Stock,$69.25,-0.44,-0.631%,88944628534.00,United States,,4392017,Consumer Staples,Retail-Drug Stores and Proprietary Stores
CVX,Chevron Corporation Common Stock,$166.93,0.39,0.234%,311699244241.00,United States,,6167574,Energy,Integrated oil Companies
CW,Curtiss-Wright Corporation Common Stock,$192.95,-0.10,-0.052%,7391035034.00,United States,,226324,Industrials,Industrial Machinery/Components
CWAN,Clearwater Analytics Holdings Inc. Class A Common Stock,$19.10,-0.28,-1.445%,4620674292.00,United States,2021,1014914,Technology,Computer Software: Prepackaged Software
CWEN,Clearway Energy Inc. Class C Common Stock,$19.26,-0.49,-2.481%,3891969065.00,United States,2015,1724724,Utilities,Electric Utilities: Central
CWST,Casella Waste Systems Inc. Class A Common Stock,$74.77,-0.53,-0.704%,4333837358.00,United States,1997,210705,Utilities,Environmental Services
CWT,California Water Service Group Common Stock,$46.43,0.15,0.324%,2679103860.00,United States,,369473,Utilities,Water Supply
CX,Cemex S.A.B. de C.V. Sponsored ADR,$6.14,-0.31,-4.806%,9032868810.00,Mexico,,8106891,Industrials,Building Materials
CXM,Sprinklr Inc. Class A Common Stock,$13.72,-0.26,-1.86%,3710902457.00,United States,2021,1023699,Technology,Computer Software: Prepackaged Software
CXT,Crane NXT Co. Common Stock,$53.02,-1.44,-2.644%,3011373335.00,United States,,391396,Industrials,Metal Fabrications
CYBR,CyberArk Software Ltd. Ordinary Shares,$156.73,-7.83,-4.758%,6430631900.00,Israel,2014,397078,Technology,Computer Software: Prepackaged Software
CYTK,Cytokinetics Incorporated Common Stock,$26.88,-1.00,-3.587%,2580426186.00,United States,2004,1386820,Health Care,Biotechnology: Pharmaceutical Preparations
CZR,Caesars Entertainment Inc. Common Stock,$45.09,-1.77,-3.777%,9707420374.00,United States,,2618948,Consumer Discretionary,Hotels/Resorts
D,Dominion Energy Inc. Common Stock,$42.47,0.16,0.378%,35549413101.00,United States,,10465818,Utilities,Electric Utilities: Central
DAL,Delta Air Lines Inc. Common Stock,$35.24,-1.21,-3.32%,22674063535.00,United States,,9399947,Consumer Discretionary,Air Freight/Delivery Services
DAR,Darling Ingredients Inc. Common Stock,$48.73,-2.03,-3.999%,7772001303.00,United States,1997,1576458,Consumer Staples,Packaged Foods
DASH,DoorDash Inc. Class A Common Stock,$77.25,-2.19,-2.757%,30382254818.00,United States,,2401777,Industrials,Industrial Machinery/Components
DAVA,Endava plc American Depositary Shares (each representing one Class A Ordinary Share),$56.00,-1.29,-2.252%,3234055384.00,United Kingdom,2018,393585,Technology,EDP Services
DB,Deutsche Bank AG Common Stock,$10.37,-0.24,-2.262%,21154800000.00,Germany,,4178033,Finance,Major Banks
DBRG,DigitalBridge Group Inc.,$16.14,-0.71,-4.214%,2625012618.00,United States,2014,1370844,Real Estate,Real Estate Investment Trusts
DBX,Dropbox Inc. Class A Common Stock,$26.79,-0.51,-1.868%,9317506786.00,United States,2018,1910753,Technology,Computer Software: Prepackaged Software
DCI,Donaldson Company Inc. Common Stock,$59.37,-0.35,-0.586%,7198148642.00,United States,,337564,Industrials,Pollution Control Equipment
DD,DuPont de Nemours Inc. Common Stock,$73.49,0.17,0.232%,33736394139.00,United States,2017,3074904,Industrials,Major Chemicals
DDOG,Datadog Inc. Class A Common Stock,$86.97,-4.87,-5.303%,28265202949.00,United States,2019,3573397,Technology,Computer Software: Prepackaged Software
DDS,Dillard's Inc. Common Stock,$314.51,-11.41,-3.501%,5165755671.00,United States,,126359,Consumer Discretionary,Department/Specialty Retail Stores
DE,Deere & Company Common Stock,$372.78,-1.06,-0.284%,107360855094.00,United States,,1212251,Industrials,Industrial Machinery/Components
DECK,Deckers Outdoor Corporation Common Stock,$508.12,-9.43,-1.822%,13279440799.00,United States,1993,308499,Consumer Discretionary,Shoe Manufacturing
DELL,Dell Technologies Inc. Class C Common Stock ,$67.24,-0.46,-0.679%,48643207475.00,United States,2018,4328769,Technology,Computer Manufacturing
DEN,Denbury Inc. Common Stock,$97.03,0.09,0.093%,4939023292.00,,2020,936022,Energy,Oil & Gas Production
DEO,Diageo plc Common Stock,$146.98,-0.23,-0.156%,82566015000.00,United Kingdom,,349085,Consumer Staples,Beverages (Production/Distribution)
DFS,Discover Financial Services Common Stock,$87.26,-3.57,-3.93%,21810462131.00,United States,,3830484,Finance,Finance: Consumer Services
DG,Dollar General Corporation Common Stock,$105.59,1.81,1.744%,23174523318.00,United States,2009,4011107,Consumer Discretionary,Department/Specialty Retail Stores
DGX,Quest Diagnostics Incorporated Common Stock,$121.03,0.12,0.099%,13583801929.00,United States,,706154,Health Care,Medical Specialities
DHCNI,Diversified Healthcare Trust 5.625% Senior Notes due 2042,$14.31,0.10,0.704%,3431348579.00,United States,,9361,Real Estate,Real Estate Investment Trusts
DHCNL,Diversified Healthcare Trust 6.25% Senior Notes Due 2046,$15.30,0.06,0.394%,3668737474.00,United States,,18166,Real Estate,Real Estate Investment Trusts
DHI,D.R. Horton Inc. Common Stock,$102.85,-3.33,-3.136%,34793801607.00,United States,,4537062,Consumer Discretionary,Homebuilding
DHR,Danaher Corporation Common Stock,$215.70,1.96,0.917%,159262550990.00,United States,,4817051,Industrials,Industrial Machinery/Components
DINO,HF Sinclair Corporation Common Stock,$54.15,-2.25,-3.989%,9969742614.00,United States,1960,2289664,Energy,Natural Gas Distribution
DIOD,Diodes Incorporated Common Stock,$79.41,-0.81,-1.01%,3647998996.00,United States,,392456,Technology,Semiconductors
DIS,Walt Disney Company (The) Common Stock,$79.54,-2.13,-2.608%,145540604877.00,United States,,12555098,Consumer Discretionary,Movies/Entertainment
DISH,DISH Network Corporation Class A Common Stock,$5.15,-0.44,-7.871%,2749374973.00,United States,1995,14666408,Telecommunications,Cable & Other Pay Television Services
DKNG,DraftKings Inc. Class A Common Stock,$27.87,-1.17,-4.029%,23884276128.00,United States,2019,9962485,Consumer Discretionary,Services-Misc. Amusement & Recreation
DKS,Dick's Sporting Goods Inc Common Stock,$104.22,-2.08,-1.957%,8861111234.00,United States,2002,1493730,Consumer Discretionary,Other Specialty Stores
DLB,Dolby Laboratories Common Stock,$79.15,-1.55,-1.921%,7570004463.00,United States,2005,415461,Miscellaneous,Multi-Sector Companies
DLO,DLocal Limited Class A Common Shares,$18.81,-0.81,-4.128%,3049289100.00,Uruguay,2021,669965,Consumer Discretionary,Business Services
DLR,Digital Realty Trust Inc. Common Stock,$115.15,-3.07,-2.597%,34856975319.00,United States,2004,2668223,Real Estate,Real Estate Investment Trusts
DLTR,Dollar Tree Inc. Common Stock,$103.64,-1.02,-0.975%,22801373855.00,United States,1995,2585452,Consumer Discretionary,Department/Specialty Retail Stores
DNA,Ginkgo Bioworks Holdings Inc. Class A Common Stock,$1.60,-0.11,-6.433%,3358164771.00,United States,2021,25028571,Health Care,Biotechnology: Biological Products (No Diagnostic Substances)
DNB,Dun & Bradstreet Holdings Inc. Common Stock,$9.53,-0.45,-4.509%,4185823999.00,United States,2020,1507212,Finance,Finance: Consumer Services
DNLI,Denali Therapeutics Inc. Common Stock,$20.75,0.96,4.851%,2851509218.00,United States,2017,1037437,Health Care,Biotechnology: Biological Products (No Diagnostic Substances)
DNUT,Krispy Kreme Inc. Common Stock,$12.51,0.08,0.644%,2104182000.00,United States,2021,1398766,Consumer Staples,Food Chains
DOC,Physicians Realty Trust Common Shares of Beneficial Interest,$11.43,-0.20,-1.72%,2725533746.00,United States,2013,2146791,Real Estate,Real Estate Investment Trusts
DOCN,DigitalOcean Holdings Inc. Common Stock,$23.02,-0.90,-3.763%,2045275412.00,United States,2021,913297,Technology,Retail: Computer Software & Peripheral Equipment
DOCS,Doximity Inc. Class A Common Stock,$21.34,0.15,0.708%,4155159884.00,United States,2021,2111863,Technology,Retail: Computer Software & Peripheral Equipment
DOCU,DocuSign Inc. Common Stock,$41.52,-0.21,-0.503%,8437074963.00,United States,1989,3754808,Technology,Computer Software: Prepackaged Software
DOOO,BRP Inc. (Recreational Products) Common Subordinate Voting Shares,$74.16,-1.92,-2.524%,5733486917.00,Canada,,112337,Consumer Discretionary,Industrial Specialties
DORM,Dorman Products Inc. Common Stock,$75.54,0.54,0.72%,2378615909.00,United States,,59071,Consumer Discretionary,Auto Parts:O.E.M.
DOV,Dover Corporation Common Stock,$137.78,0.10,0.073%,19271815609.00,United States,,551348,Industrials,Industrial Machinery/Components
DOW,Dow Inc. Common Stock ,$51.02,-0.28,-0.546%,35870869000.00,United States,2019,5179207,Industrials,Major Chemicals
DOX,Amdocs Limited Ordinary Shares,$83.96,-0.04,-0.048%,10144047200.00,Guernsey,,694139,Technology,EDP Services
DPZ,Domino's Pizza Inc Common Stock,$364.18,-16.36,-4.299%,12780643631.00,United States,2004,663320,Consumer Discretionary,Food Distributors
DQ,DAQO New Energy Corp. American Depositary Shares each representing five ordinary shares,$28.77,-0.80,-2.705%,2249948212.00,China,2010,988506,Technology,Semiconductors
DRI,Darden Restaurants Inc. Common Stock,$139.83,-2.58,-1.812%,16823604082.00,United States,,1317713,Consumer Discretionary,Restaurants
DRS,Leonardo DRS Inc. Common Stock,$16.18,-0.09,-0.553%,4239160000.00,Israel,,353237,Industrials,Military/Government/Technical
DRVN,Driven Brands Holdings Inc. Common Stock,$11.99,-0.07,-0.58%,2008713260.00,United States,2021,1659341,Consumer Discretionary,Automotive Aftermarket
